<?xml version="1.0" encoding="utf-8" ?>
<Definition
    xmlns="urn:x-plazacraft.org:plazacraft.homm3-1.0-damagesymulator"
    xmlns:xs="http://www.w3.org/2001/XMLSchema"
    xmlns:xsi="http://www.w3.org/2001/XMLSchema-instance"
    xsi:schemaLocation="urn:x-plazacraft.org:plazacraft.homm3-1.0-damagesymulator http://homm3.plazacraft.com/damagesymulator/schemas/Plazacraft.HOMM3.DamageSymulator.Definition.xsd"
    >

 <Modificators>
	<Modificator Name="Creature Speciality Attack" RoundType="Up">%CreatureAttack% *0.05 * ((%HeroLevel% / %CreatureLevel%) - ((%HeroLevel% % %CreatureLevel%) / %CreatureLevel%))</Modificator>	
	<Modificator Name="Creature Speciality Defense" RoundType="Up">%CreatureAttack% *0.05 * ((%HeroLevel% / %CreatureLevel%) - ((%HeroLevel% % %CreatureLevel%) / %CreatureLevel%))</Modificator>	
	<Modificator Name="Hate">0.5</Modificator>	
	<Modificator Name="Elementals">1</Modificator>	
 </Modificators>
	
 <SecondarySkills>
	<SecondarySkill Name="Archery">
		<Factor Type="I2" AttackType="Ranged"> 
			<LevelModificator>
				<Level_0>0</Level_0>
				<Level_1>0.10</Level_1>
				<Level_2>0.25</Level_2>
				<Level_3>0.50</Level_3>
			</LevelModificator>
		</Factor>   
	</SecondarySkill> 
	<SecondarySkill Name="Offense">
		<Factor Type="I2" AttackType="Melee"> 
			<LevelModificator>
				<Level_0>0</Level_0>
				<Level_1>0.10</Level_1>
				<Level_2>0.20</Level_2>
				<Level_3>0.30</Level_3>
			</LevelModificator>
		</Factor>  
	</SecondarySkill> 
	<SecondarySkill Name="Armorer">
		<Factor Type="R2" AttackType="Melee Ranged"> 
			<LevelModificator>  
				<Level_0>0</Level_0> 
				<Level_1>0.05</Level_1>
				<Level_2>0.10</Level_2>
				<Level_3>0.15</Level_3>
			</LevelModificator>
		</Factor>  
	</SecondarySkill> 	
 </SecondarySkills>
 
 <HeroAbilities>
	<HeroAbility Name="Offense">
		<Factor Type="I3" AttackType="Melee"> 
			<Modificator>(0.05 * %HeroLevel%) * %I2%</Modificator>
		</Factor>  
	</HeroAbility>
	<HeroAbility Name="Archery">
		<Factor Type="I3" AttackType="Ranged"> 
			<Modificator>(0.05 * %HeroLevel%)* %I2%</Modificator>
		</Factor>  
	</HeroAbility>
	<HeroAbility Name="Bless">
		<Factor Type="I3" AttackType="Melee"> 
			<Modificator>0.03 * %HeroLevel% / %CreatureLevel%</Modificator>
		</Factor>  
	</HeroAbility>	
	<HeroAbility Name="Armorer">
		<Factor Type="R3" AttackType="Melee Ranged"> 
			<Modificator>0.05 * %HeroLevel%</Modificator>
		</Factor>  
	</HeroAbility>	
	<HeroAbility Name="Speciality Archers">
		<Factor Type="I1" AttackType="Melee Ranged" Affected="Archer">
			<ModificatorRef Name="Creature Speciality Attack" />
		</Factor>
		<Factor Type="R1" AttackType="Melee Ranged" Affected="Archer">
			<ModificatorRef Name="Creature Speciality Defense" />
		</Factor>
		<Factor Type="I1" AttackType="Melee Ranged" Affected="Marksman">
			<ModificatorRef Name="Creature Speciality Attack" />
		</Factor> 
		<Factor Type="R1" AttackType="Melee Ranged" Affected="Marksmen">
			<ModificatorRef Name="Creature Speciality Defense" />
		</Factor> 
	</HeroAbility>	
	<HeroAbility Name="Speciality Basilisks">
		<Factor Type="I1" AttackType="Melee Ranged" Affected="Basilisk">
			<ModificatorRef Name="Creature Speciality Attack" />
		</Factor>
		<Factor Type="R1" AttackType="Melee Ranged" Affected="Basilisk">
			<ModificatorRef Name="Creature Speciality Defense" />
		</Factor>
		<Factor Type="I1" AttackType="Melee Ranged" Affected="Greater Basilisk">
			<ModificatorRef Name="Creature Speciality Attack" />
		</Factor> 
		<Factor Type="R1" AttackType="Melee Ranged" Affected="Greater Basilisk">
			<ModificatorRef Name="Creature Speciality Defense" />
		</Factor> 
	</HeroAbility>	
	<HeroAbility Name="Speciality Behemoths">
		<Factor Type="I1" AttackType="Melee Ranged" Affected="Behemoth">
			<ModificatorRef Name="Creature Speciality Attack" />
		</Factor>
		<Factor Type="R1" AttackType="Melee Ranged" Affected="Behemoth">
			<ModificatorRef Name="Creature Speciality Defense" />
		</Factor>
		<Factor Type="I1" AttackType="Melee Ranged" Affected="Ancient Behemoth">
			<ModificatorRef Name="Creature Speciality Attack" />
		</Factor> 
		<Factor Type="R1" AttackType="Melee Ranged" Affected="Ancient Behemoth">
			<ModificatorRef Name="Creature Speciality Defense" />
		</Factor> 
	</HeroAbility>	
	<HeroAbility Name="Speciality Beholders">
		<Factor Type="I1" AttackType="Melee Ranged" Affected="Beholder">
			<ModificatorRef Name="Creature Speciality Attack" />
		</Factor>
		<Factor Type="R1" AttackType="Melee Ranged" Affected="Beholder">
			<ModificatorRef Name="Creature Speciality Defense" />
		</Factor>
		<Factor Type="I1" AttackType="Melee Ranged" Affected="Evil Eye">
			<ModificatorRef Name="Creature Speciality Attack" />
		</Factor> 
		<Factor Type="R1" AttackType="Melee Ranged" Affected="Evil Eye">
			<ModificatorRef Name="Creature Speciality Defense" />
		</Factor> 
	</HeroAbility>	
	<HeroAbility Name="Speciality Black Knights">
		<Factor Type="I1" AttackType="Melee Ranged" Affected="Black Knight">
			<ModificatorRef Name="Creature Speciality Attack" />
		</Factor>
		<Factor Type="R1" AttackType="Melee Ranged" Affected="Black Knight">
			<ModificatorRef Name="Creature Speciality Defense" />
		</Factor>
		<Factor Type="I1" AttackType="Melee Ranged" Affected="Dread Knight">
			<ModificatorRef Name="Creature Speciality Attack" />
		</Factor> 
		<Factor Type="R1" AttackType="Melee Ranged" Affected="Dread Knight">
			<ModificatorRef Name="Creature Speciality Defense" />
		</Factor> 
	</HeroAbility>	
	<HeroAbility Name="Speciality Cavaliers">
		<Factor Type="I1" AttackType="Melee Ranged" Affected="Cavalier">
			<ModificatorRef Name="Creature Speciality Attack" />
		</Factor>
		<Factor Type="R1" AttackType="Melee Ranged" Affected="Cavalier">
			<ModificatorRef Name="Creature Speciality Defense" />
		</Factor>
		<Factor Type="I1" AttackType="Melee Ranged" Affected="Champion">
			<ModificatorRef Name="Creature Speciality Attack" />
		</Factor> 
		<Factor Type="R1" AttackType="Melee Ranged" Affected="Champion">
			<ModificatorRef Name="Creature Speciality Defense" />
		</Factor> 
	</HeroAbility>	
	<HeroAbility Name="Speciality Cyclops">
		<Factor Type="I1" AttackType="Melee Ranged" Affected="Cyclops">
			<ModificatorRef Name="Creature Speciality Attack" />
		</Factor>
		<Factor Type="R1" AttackType="Melee Ranged" Affected="Cyclops">
			<ModificatorRef Name="Creature Speciality Defense" />
		</Factor>
		<Factor Type="I1" AttackType="Melee Ranged" Affected="Cyclops King">
			<ModificatorRef Name="Creature Speciality Attack" />
		</Factor> 
		<Factor Type="R1" AttackType="Melee Ranged" Affected="Cyclops King">
			<ModificatorRef Name="Creature Speciality Defense" />
		</Factor> 
	</HeroAbility>	
	<HeroAbility Name="Speciality Demons">
		<Factor Type="I1" AttackType="Melee Ranged" Affected="Demon">
			<ModificatorRef Name="Creature Speciality Attack" />
		</Factor>
		<Factor Type="R1" AttackType="Melee Ranged" Affected="Demon">
			<ModificatorRef Name="Creature Speciality Defense" />
		</Factor>
		<Factor Type="I1" AttackType="Melee Ranged" Affected="Horned Demon">
			<ModificatorRef Name="Creature Speciality Attack" />
		</Factor> 
		<Factor Type="R1" AttackType="Melee Ranged" Affected="Horned Demon">
			<ModificatorRef Name="Creature Speciality Defense" />
		</Factor> 
	</HeroAbility>	
	<HeroAbility Name="Speciality Dendroids">
		<Factor Type="I1" AttackType="Melee Ranged" Affected="Dendroid Guard">
			<ModificatorRef Name="Creature Speciality Attack" />
		</Factor>
		<Factor Type="R1" AttackType="Melee Ranged" Affected="Dendroid Guard">
			<ModificatorRef Name="Creature Speciality Defense" />
		</Factor>
		<Factor Type="I1" AttackType="Melee Ranged" Affected="Dendroid Soldier">
			<ModificatorRef Name="Creature Speciality Attack" />
		</Factor> 
		<Factor Type="R1" AttackType="Melee Ranged" Affected="Dendroid Soldier">
			<ModificatorRef Name="Creature Speciality Defense" />
		</Factor> 
	</HeroAbility>		
	<HeroAbility Name="Speciality Devils">
		<Factor Type="I1" AttackType="Melee Ranged" Affected="Devil">
			<Modificator>4</Modificator>
		</Factor>
		<Factor Type="R1" AttackType="Melee Ranged" Affected="Devil">
			<Modificator>2</Modificator>
		</Factor>
		<Factor Type="I1" AttackType="Melee Ranged" Affected="Arch Devil">
			<Modificator>4</Modificator>
		</Factor> 
		<Factor Type="R1" AttackType="Melee Ranged" Affected="Arch Devil">
			<Modificator>2</Modificator>
		</Factor> 
	</HeroAbility>		
	<HeroAbility Name="Speciality Dragons">
		<Factor Type="I1" AttackType="Melee Ranged" Affected="Green Dragon">
			<Modificator>5</Modificator>
		</Factor>
		<Factor Type="R1" AttackType="Melee Ranged" Affected="Green Dragon">
			<Modificator>5</Modificator>
		</Factor>
		<Factor Type="I1" AttackType="Melee Ranged" Affected="Gold Dragon">
			<Modificator>5</Modificator>
		</Factor>
		<Factor Type="R1" AttackType="Melee Ranged" Affected="Gold Dragon">
			<Modificator>5</Modificator>
		</Factor>
		<Factor Type="I1" AttackType="Melee Ranged" Affected="Bone Dragon">
			<Modificator>5</Modificator>
		</Factor>
		<Factor Type="R1" AttackType="Melee Ranged" Affected="Bone Dragon">
			<Modificator>5</Modificator>
		</Factor>
		<Factor Type="I1" AttackType="Melee Ranged" Affected="Ghost Dragon">
			<Modificator>5</Modificator>
		</Factor>
		<Factor Type="R1" AttackType="Melee Ranged" Affected="Ghost Dragon">
			<Modificator>5</Modificator>
		</Factor>
		<Factor Type="I1" AttackType="Melee Ranged" Affected="Red Dragon">
			<Modificator>5</Modificator>
		</Factor>
		<Factor Type="R1" AttackType="Melee Ranged" Affected="Red Dragon">
			<Modificator>5</Modificator>
		</Factor>
		<Factor Type="I1" AttackType="Melee Ranged" Affected="Black Dragon">
			<Modificator>5</Modificator>
		</Factor>